{
  "id": "story.tl_2",
  "kind": "story",
  "status": "implemented",
  "name": "TL-2 Top-Down Discovery Walkthrough",
  "current_path": "docs/nextlens/src/nextlens-src-topdownlens/stories/TL-2.md",
  "summary": "Story that records the first top-down discovery walkthrough from system thesis to selected feature packet.",
  "hierarchy": {
    "feature": "feature.topdownlens_contract",
    "story": "story.tl_2"
  },
  "produces": [],
  "consumes": ["story.tl_1"],
  "relationships": [],
  "promotion_evidence": [],
  "provenance": {
    "source_documents": ["docs/nextlens/src/nextlens-src-topdownlens/stories/TL-2.md"],
    "confidence": "high"
  }
}