{
  "id": "test.tl_1.schema_validation",
  "kind": "test",
  "status": "validated",
  "name": "TL-1 schema validation",
  "current_path": "docs/nextlens/src/nextlens-src-topdownlens/examples/derived-graph-example.json",
  "summary": "Validation that schemas parse and examples conform to their contracts.",
  "hierarchy": {
    "feature": "feature.topdownlens_contract",
    "story": "story.tl_1",
    "task": "task.tl_1.define_schemas",
    "code": "code.tl_1.schemas",
    "test": "test.tl_1.schema_validation"
  },
  "produces": ["evidence.tl1_schema_validation"],
  "consumes": ["code.tl_1.schemas"],
  "relationships": [],
  "promotion_evidence": [],
  "provenance": {
    "source_documents": ["docs/nextlens/src/nextlens-src-topdownlens/stories/TL-1.md"],
    "confidence": "high"
  }
}