{
  "id": "product_area.planning_intelligence",
  "kind": "product_area",
  "status": "candidate",
  "name": "Planning Intelligence",
  "current_path": "_bmad-output/lens/landscape/product-areas/planning-intelligence.json",
  "summary": "Product area that turns raw system intent into traceable feature candidates.",
  "hierarchy": {
    "system": "system.nextlens",
    "product_area": "product_area.planning_intelligence"
  },
  "produces": [],
  "consumes": [],
  "relationships": [],
  "promotion_evidence": [],
  "provenance": {
    "source_documents": ["docs/nextlens/src/nextlens-src-topdownlens/business-plan.md"],
    "confidence": "medium"
  }
}